"Contribution ID",Contributor,Contribution,Value,Reimbursement,Date,Project,Description,Slices
1301,"Brian Farenbach",Time,1,0,2014-10-03,"General Operations","Met with Mike to discuss basic strategy for our proof of concept in Lake Forest.",100
1302,"Brian Farenbach",Time,1,0,2014-10-03,"Product Development","Work on possible system to identify good kids who would be good mentors for GOAP, but might not have the highest GPAs.  The system could include inputs like GPA, volunteer work, and references.  Each input could be worth a certain number of points and in order to qualify you need to reach a certain threshold of points.",100
1402,"Brian Farenbach",Time,3.5,0,2014-10-14,"General Operations","Finish drafting User Agreement",350
1410,"Brian Farenbach",Time,0,0,2014-10-14,Management,"Status meeting with Mike.  We discussed what we accomplished since our last meeting and laid out our goals before our next meeting.",0
1411,"Brian Farenbach",Time,0.75,0,2014-10-14,Management,"Status meeting with Mike.  We discussed what we accomplished since our last meeting and laid out our goals before our next meeting.",75
1412,"Brian Farenbach",Time,0,0,2014-06-12,Management,"Research subscription-based models for similar sites.",0
1413,"Brian Farenbach",Time,0.5,0,2014-06-12,Management,"Research subscription-based models for similar sites.",50
